{
  "schema_version": 1,
  "namespace": "industrial_frontier",
  "registry_id": "industrial_frontier:m2/worldgen_ownership",
  "status": "STATIC_COMPLETE_USER_GATE_PENDING",
  "scope_ru": "Текущие владельцы технической геологии и уникальных AE2-структур плюс заблокированные правила для будущих атомных и планетарных ресурсов. Биомы, фауна и декоративные структуры находятся вне этого реестра.",
  "ownership_decisions": [
    {
      "decision_id": "industrial_frontier:worldgen/gtceu_geological_ores",
      "resource_class": "GEOLOGICAL_ORES",
      "status": "ACTIVE_CONFIGURED",
      "world_impact": true,
      "canonical_owner_domain_ref": "industrial_frontier:domain/industrial_chemistry_metallurgy",
      "canonical_owner_mod_ids": [
        "gtceu"
      ],
      "disabled_provider_mod_ids": [
        "create"
      ],
      "future_provider_labels": [],
      "scope_dimensions": [
        "minecraft:overworld",
        "minecraft:the_nether",
        "minecraft:the_end"
      ],
      "decision_ru": "GTCEu является единственным действующим владельцем общей рудной геологии; новый поставщик допускается только для уникального паспортизованного ресурса.",
      "implementation_checks": [
        {
          "path": "config/gtceu.yaml",
          "key_or_resource": "worldgen.oreVeins.oreVeinGridSize",
          "expected": "3",
          "status": "STATIC_CONFIRMED"
        },
        {
          "path": "config/create-common.toml",
          "key_or_resource": "worldgen.disableWorldGen",
          "expected": "true",
          "status": "STATIC_CONFIRMED"
        }
      ],
      "evidence_refs": [
        "industrial_frontier:evidence/worldgen/gtceu_config",
        "industrial_frontier:evidence/worldgen/create_config",
        "industrial_frontier:evidence/worldgen/master_decision"
      ],
      "gate_refs": [
        "industrial_frontier:gate/worldgen/config_static"
      ]
    },
    {
      "decision_id": "industrial_frontier:worldgen/vanilla_ores_suppressed",
      "resource_class": "VANILLA_ORES",
      "status": "DISABLED_DUPLICATE",
      "world_impact": true,
      "canonical_owner_domain_ref": "industrial_frontier:domain/industrial_chemistry_metallurgy",
      "canonical_owner_mod_ids": [
        "gtceu"
      ],
      "disabled_provider_mod_ids": [
        "minecraft"
      ],
      "future_provider_labels": [],
      "scope_dimensions": [
        "minecraft:overworld"
      ],
      "decision_ru": "Обычные и крупные ванильные рудные жилы подавляются, чтобы сырьё входило через единую GTCEu-геологию.",
      "implementation_checks": [
        {
          "path": "config/gtceu.yaml",
          "key_or_resource": "worldgen.oreVeins.removeVanillaOreGen",
          "expected": "true",
          "status": "STATIC_CONFIRMED"
        },
        {
          "path": "config/gtceu.yaml",
          "key_or_resource": "worldgen.oreVeins.removeVanillaLargeOreVeins",
          "expected": "true",
          "status": "STATIC_CONFIRMED"
        }
      ],
      "evidence_refs": [
        "industrial_frontier:evidence/worldgen/gtceu_config"
      ],
      "gate_refs": [
        "industrial_frontier:gate/worldgen/config_static"
      ]
    },
    {
      "decision_id": "industrial_frontier:worldgen/zinc_canonical_gtceu",
      "resource_class": "ZINC_ORE",
      "status": "DISABLED_DUPLICATE",
      "world_impact": true,
      "canonical_owner_domain_ref": "industrial_frontier:domain/industrial_chemistry_metallurgy",
      "canonical_owner_mod_ids": [
        "gtceu"
      ],
      "disabled_provider_mod_ids": [
        "create"
      ],
      "future_provider_labels": [],
      "scope_dimensions": [
        "minecraft:overworld"
      ],
      "decision_ru": "Create:zinc_ore и deepslate_zinc_ore остаются зарегистрированными формами совместимости, но не являются источником мира; цинк поступает через GTCEu-геологию.",
      "implementation_checks": [
        {
          "path": "config/create-common.toml",
          "key_or_resource": "worldgen.disableWorldGen",
          "expected": "true",
          "status": "STATIC_CONFIRMED"
        }
      ],
      "evidence_refs": [
        "industrial_frontier:evidence/worldgen/create_config",
        "industrial_frontier:evidence/worldgen/create_zinc_tag",
        "industrial_frontier:evidence/worldgen/master_decision"
      ],
      "gate_refs": [
        "industrial_frontier:gate/worldgen/config_static"
      ]
    },
    {
      "decision_id": "industrial_frontier:worldgen/ae2_meteorites",
      "resource_class": "UNIQUE_STRUCTURE",
      "status": "PRESERVED_UNIQUE",
      "world_impact": true,
      "canonical_owner_domain_ref": "industrial_frontier:domain/digital_factory",
      "canonical_owner_mod_ids": [
        "ae2"
      ],
      "disabled_provider_mod_ids": [],
      "future_provider_labels": [],
      "scope_dimensions": [
        "biomes in #ae2:has_meteorites"
      ],
      "decision_ru": "AE2-метеориты сохраняются как уникальная структура обучения/доступа, а не как второй общий владелец земной рудной геологии.",
      "implementation_checks": [
        {
          "path": "mods/appliedenergistics2-forge-15.4.10.jar!/data/ae2/worldgen/structure/meteorite.json",
          "key_or_resource": "ae2:meteorite",
          "expected": "structure present; biome tag #ae2:has_meteorites",
          "status": "STATIC_CONFIRMED"
        }
      ],
      "evidence_refs": [
        "industrial_frontier:evidence/worldgen/ae2_meteorite_structure"
      ],
      "gate_refs": [
        "industrial_frontier:gate/worldgen/config_static",
        "industrial_frontier:gate/worldgen/owner_visual_test"
      ]
    },
    {
      "decision_id": "industrial_frontier:worldgen/certus_sources",
      "resource_class": "GEOLOGICAL_ORES",
      "status": "STATIC_POLICY_DECIDED_USER_TEST_PENDING",
      "world_impact": true,
      "canonical_owner_domain_ref": "industrial_frontier:domain/industrial_chemistry_metallurgy",
      "canonical_owner_mod_ids": [
        "gtceu"
      ],
      "disabled_provider_mod_ids": [],
      "future_provider_labels": [
        "AE2 budding certus as a controlled renewable route"
      ],
      "scope_dimensions": [
        "minecraft:overworld",
        "biomes in #ae2:has_meteorites"
      ],
      "decision_ru": "GTCEu-жила, AE2-метеориты и возобновляемое выращивание сохраняются; семь входных AE2-рецептов блокируют практическое открытие цифрового домена до P5, а частоту источников проверяет владелец.",
      "implementation_checks": [
        {
          "path": "mods/gtceu-1.20.1-7.5.3.jar!/assets/gtceu/lang/en_us.json",
          "key_or_resource": "gtceu.jei.ore_vein.certus_quartz",
          "expected": "present",
          "status": "STATIC_CONFIRMED"
        },
        {
          "path": "mods/appliedenergistics2-forge-15.4.10.jar!/assets/ae2/ae2guide/ae2-mechanics/certus-growth.md",
          "key_or_resource": "renewable budding growth route",
          "expected": "present",
          "status": "STATIC_CONFIRMED"
        }
      ],
      "evidence_refs": [
        "industrial_frontier:evidence/worldgen/gtceu_certus",
        "industrial_frontier:evidence/worldgen/ae2_certus_growth",
        "industrial_frontier:evidence/worldgen/ae2_meteorite_structure"
      ],
      "gate_refs": [
        "industrial_frontier:gate/worldgen/certus_overlap"
      ]
    },
    {
      "decision_id": "industrial_frontier:worldgen/future_atomic_feedstocks",
      "resource_class": "ATOMIC_FEEDSTOCK_ORES",
      "status": "DISABLED_DUPLICATE",
      "world_impact": true,
      "canonical_owner_domain_ref": "industrial_frontier:domain/industrial_chemistry_metallurgy",
      "canonical_owner_mod_ids": [
        "gtceu"
      ],
      "disabled_provider_mod_ids": [
        "nuclearcraft",
        "hbm_ntm_rebirth"
      ],
      "future_provider_labels": [],
      "scope_dimensions": [
        "minecraft:overworld"
      ],
      "decision_ru": "Геология остаётся у GregTech. Рудная генерация NuclearCraft перекрыта датапаком целиком — 24 из 24 модификаторов биома; у HBM-NTM Rebirth перекрыты все три, которыми порт раскладывает надмирье, Нижний мир и Край.",
      "implementation_checks": [
        {
          "path": "config/paxi/datapacks/IndustrialFrontier-Data/data",
          "key_or_resource": "nuclearcraft/forge/biome_modifier (24) и hbm_ntm_rebirth/forge/biome_modifier (3)",
          "expected": "forge:none for every ore modifier of both atomic mods",
          "status": "STATIC_CONFIRMED"
        }
      ],
      "evidence_refs": [
        "industrial_frontier:evidence/worldgen/federation_future"
      ],
      "gate_refs": [
        "industrial_frontier:gate/worldgen/future_atomic"
      ]
    },
    {
      "decision_id": "industrial_frontier:worldgen/future_planetary_resources",
      "resource_class": "PLANETARY_RESOURCES",
      "status": "PRESERVED_UNIQUE",
      "world_impact": true,
      "canonical_owner_domain_ref": "industrial_frontier:domain/planetary_spaceflight",
      "canonical_owner_mod_ids": [
        "gcyr"
      ],
      "disabled_provider_mod_ids": [
        "creatingspace"
      ],
      "future_provider_labels": [],
      "scope_dimensions": [
        "gcyr:luna",
        "gcyr:mars",
        "gcyr:mercury",
        "gcyr:venus",
        "gcyr:proxima_centauri_b"
      ],
      "decision_ru": "Планетарные жилы принадлежат GCYR и генерируются механизмом GregTech, то есть тем же владельцем, что и земные: боксит на Луне, медь, железо, никель, цинк, вольфрамат и редкозем на Марсе, ртуть на Меркурии, сера и вольфрамотитанат на Венере. Никелевая жила Creating Space в надмирье отключена, его планетарные измерения остаются в реестре, но недостижимы ракетой.",
      "implementation_checks": [
        {
          "path": "config/paxi/datapacks/IndustrialFrontier-Data/data/creatingspace",
          "key_or_resource": "forge/biome_modifier/add_nickel_overworld_ore.json и creatingspace/rocket_accessible_dimension",